Job_ID,Job_Title,Required_Skills,Recommended_Courses
1,Data Analyst,"Python SQL Excel Power BI Statistics","Python for Data Analysis; SQL Fundamentals; Microsoft Excel Advanced; Power BI Essentials; Statistics for Data Analysis"
2,Data Scientist,"Python Machine Learning Statistics Pandas NumPy SQL","Machine Learning with Scikit-learn; Statistics for Data Science; Pandas Bootcamp; NumPy Fundamentals; SQL for Data Science"
3,Machine Learning Engineer,"Python Scikit-learn TensorFlow Git Docker","Scikit-learn Masterclass; TensorFlow Developer; Git & GitHub Essentials; Docker for Developers"
4,AI Engineer,"Python Deep Learning TensorFlow NLP PyTorch","Deep Learning Specialization; TensorFlow in Practice; Natural Language Processing; PyTorch Fundamentals"
5,Business Analyst,"Excel SQL Power BI Communication","Advanced Excel; SQL Fundamentals; Power BI Dashboarding; Business Communication Skills"
6,Data Engineer,"Python Spark SQL Hadoop AWS","Apache Spark Fundamentals; SQL for Data Engineering; Hadoop Essentials; AWS Cloud Practitioner"
7,Backend Developer,"Python Django PostgreSQL Git Docker","Django Web Development; PostgreSQL Basics; Git & GitHub Essentials; Docker for Beginners"
8,Python Developer,"Python Flask Django Git REST API","Python Programming Masterclass; Flask Web Development; Django Essentials; REST API Development"
9,Cloud Engineer,"AWS Docker Linux Kubernetes Python","AWS Cloud Practitioner; Docker Essentials; Linux Administration; Kubernetes Basics"
10,NLP Engineer,"Python NLP Transformers TensorFlow","Natural Language Processing; Hugging Face Transformers; TensorFlow in Practice"
11,BI Developer,"Power BI SQL Excel Data Visualization","Power BI Essentials; SQL Fundamentals; Advanced Excel; Data Visualization Techniques"
12,AI Researcher,"Python Deep Learning PyTorch NLP","Deep Learning Specialization; PyTorch Fundamentals; NLP with Python"
13,Computer Vision Engineer,"Python OpenCV TensorFlow Deep Learning","OpenCV Bootcamp; TensorFlow Developer; Deep Learning Specialization"
14,Analytics Engineer,"Python SQL Pandas Power BI","Python for Analytics; SQL Fundamentals; Pandas Bootcamp; Power BI Essentials"
15,DevOps Engineer,"Docker Kubernetes Linux Git AWS","Docker Essentials; Kubernetes Basics; Linux Administration; AWS Cloud Practitioner; Git & GitHub Essentials"
16,Software Engineer,"Java Git Docker SQL","Java Programming Masterclass; Git & GitHub Essentials; Docker Essentials; SQL Fundamentals"
17,Data Visualization Specialist,"Tableau Power BI SQL Python","Tableau Desktop Specialist; Power BI Essentials; SQL Fundamentals; Python for Data Visualization"
18,Generative AI Engineer,"Python LLM LangChain Vector Database Prompt Engineering","Generative AI Fundamentals; LangChain for LLM Applications; Prompt Engineering Guide; Vector Databases Essentials"
19,MLOps Engineer,"Python Docker Kubernetes MLflow Git","MLOps Fundamentals; MLflow Essentials; Docker Essentials; Kubernetes Basics; Git & GitHub Essentials"
20,AI Product Analyst,"Python SQL Machine Learning Communication","Python for Data Analysis; SQL Fundamentals; Machine Learning Basics; Effective Communication Skills"